[
  {
    "id": "tass:05dc5a516456aaee3b66c2aa",
    "source": "tass",
    "url": "https://tass.ru/ekonomika/28244243",
    "title": "Трамп задействовал закон времен войны в Корее для борьбы с ценами на топливо",
    "text": "ГлавнаяЭкономика и бизнес\nТрамп задействовал закон времен войны в Корее для борьбы с ценами на топливо\nДокумент позволяет президенту США расширить производство определенной продукции в целях укрепления национальной безопасности\nРедакция сайта ТАСС\n21:28\nЧитайте ТАСС в\nПрезидент США Дональд Трамп\n© AP Photo/ Evan Vucci\nВАШИНГТОН, 23 октября. /ТАСС/. Президент США Дональд Трамп назвал необходимыми для национальной обороны добычу нефти, ее переработку и другую сопутствующую деятельность, задействовав тем самым закон о производстве продукции военного назначения времен Корейской войны (1950-1953) в рамках борьбы с высокими ценами на топливо. Об этом говорится в обнародованном Белым домом меморандуме главы государства.\n\"Внутренние мощности по добыче нефти, нефтепереработке и логистике, включая разведку и добычу, транспортные трубопроводы, хранилища и морские терминалы, представляют собой промышленные ресурсы, материалы и критически важные технологические компоненты, имеющие жизненно важное значение для национальной обороны\", - отмечается в документе.\nЗакон позволяет президенту расширить производство определенной продукции в целях укрепления национальной безопасности. В этом случае Трамп разрешил Пентагону тратить средства на развитие американской нефтяной отрасли, которая теперь объявлена важной для национальной обороны, в обход обычных ограничений и уведомлений Конгресса. Американский лидер позволил военному ведомству закупать соответствующую продукцию, выдавать субсидии, займы и кредитные гарантии, финансировать строительство или расширение производств. Трамп поручил заняться этим главе Пентагона Питу Хегсету.\nСШАТрамп, Дональд",
    "published_at": "2026-10-22T21:28:11+00:00",
    "collected_at": "2026-10-22T22:07:25.132532+00:00",
    "categories": [
      "Экономика и бизнес"
    ],
    "issuer": null,
    "language": "ru"
  },
  {
    "id": "tass:406430442b23f86a91512926",
    "source": "tass",
    "url": "https://tass.ru/ekonomika/28244213",
    "title": "ANSA: почти все АЗС в районе Неаполя остались без топлива из-за забастовки",
    "text": "ГлавнаяЭкономика и бизнес\nANSA: почти все АЗС в районе Неаполя остались без топлива из-за забастовки\nСообщается также о случаях спекуляций на бензоколонках, где бензин и дизель продают по €4 за литр при средней стоимости чуть выше €2\nРедакция сайта ТАСС\n21:16\nЧитайте ТАСС в\nРИМ, 23 октября. /ТАСС/. 95% АЗС в районе Неаполя остались без топлива из-за перебоев с поставками в результате забастовки дальнобойщиков и перекрытий на дорогах. Об этом сообщает агентство ANSA.\nЧитайте также\nФранция, Италия и Албания. Что известно о протестах в Европе\nПо этой причине в зоне риска оказались перевозки на машинах медицинской помощи, а также вывоз мусора. Сообщается также о случаях спекуляций на бензоколонках, где бензин и дизель продают по €4 за литр при средней стоимости чуть выше €2. Местная прокуратура не исключает причастности мафиозных организаций к препятствию доставки грузов.\nБолее недели назад автоперевозчики начали акции с перекрытием автострад на юге Италии и на острове Сицилия в знак протеста против дороговизны топлива. Это привело к определенным сложностям в цепочке поставок. В итоге в некоторых районах в южных областях - Кампании, Апулии, Калабрии, а также на Сицилии, появился дефицит продуктов, главным образом овощей и фруктов и скоропортящихся товаров. Несколько предприятий пищевой промышленности были вынуждены приостановить производства из-за отсутствия сырья. Приостановилась работа сельхозсектора при невозможности вывоза собранного урожая. Кроме того, аграрии, столкнувшиеся с повышением себестоимости производства, также присоединись к протестам.\nВ итоге правительство приняло несколько срочных мер, выделив дополнительные средства для сектора автоперевозок и сельского хозяйства. Большинство ассоциаций перевозчиков заявили об окончании протестов. МВД одновременно начало проверки манифестирующих и принудило водителей грузовиков разъезжаться. Однако отдельные очаги протестов сохраняются. Некоторые представители сектора говорят, что \"разочарованы недостаточными мерами правительства\". Они указывают, что цены на топливо остаются высокими, а предлагаемые меры по компенсации неэффективны. Известно также, что нынешнее правительство не обладает достаточными фондами для покрытия всех расходов, связанных с удорожанием энергоносителей в целом.\nОппозиция обвиняет правительство в продолжении программ по перевооружению и оказании помощи Украине. Социальная напряженность на фоне снижения покупательной способности продолжает расти за год до очередных выборов. И последние манифестации в разных городах Италии являются свидетельством этих процессов, говорят местные наблюдатели.\nИталия",
    "published_at": "2026-10-22T21:16:41+00:00",
    "collected_at": "2026-10-22T22:07:25.132532+00:00",
    "categories": [
      "Общество",
      "Экономика и бизнес"
    ],
    "issuer": null,
    "language": "ru"
  },
  {
    "id": "tass:db0952446810960105217e8f",
    "source": "tass",
    "url": "https://tass.ru/ekonomika/28244181",
    "title": "Совет директоров Центробанка примет решение по ключевой ставке",
    "text": "ГлавнаяЭкономика и бизнесДинамика ключевой ставки Центробанка\nСовет директоров Центробанка примет решение по ключевой ставке\nБольшинство опрошенных экспертов считают, что регулятор может сохранить ее на уровне 14% годовых\nРедакция сайта ТАСС\n21:02\nЧитайте ТАСС в\nЗдание Центробанка РФ\n© Михаил Терещенко/ ТАСС\nМОСКВА, 23 октября. /Корр. ТАСС Данил Сытор/. Совет директоров Банка России на заседании 23 октября примет решение по ключевой ставке. Регулятор может сохранить ее на уровне 14% годовых, такое мнение ТАСС единогласно выразили 23 из 23 опрошенных экспертов.\nЧитайте также\nСтавка на паузу: ждут ли от Центробанка послаблений в денежно-кредитной политике\nАналитики отмечают, что пространство для снижения ставки ограничивают повышенная устойчивая инфляция, вторичные эффекты подорожания топлива и повышение тарифов ЖКХ, а также ожидаемый бюджетный импульс в конце года.\nНа предыдущем заседании в сентябре Банк России в первый раз с июня 2025 года принял решение не снижать ключевую ставку, сохранив ее на уровне 14% годовых. Регулятор тогда указал на ускорение устойчивого роста цен до 5-6% в пересчете на год, прежде всего из-за влияния временного сокращения производственных мощностей в отдельных отраслях. Вместе с тем ЦБ отмечал, что российская экономика, по оперативным данным, в III квартале 2026 года растет умеренными темпами.\nВ середине октября зампред Банка России Алексей Заботкин отмечал, что совет директоров ЦБ на заседании 23 октября уточнит свой прогноз эффектов временного выбытия производственных и логистических мощностей в разных отраслях экономики. Советник председателя ЦБ Кирилл Тремасов также заявлял, что в дальнейшем для принятия решений по ключевой ставке ЦБ будет очень важно, насколько быстро начнут затухать инфляционные процессы, насколько быстро устойчивая инфляция начнет вновь возвращаться к целевым уровням.\nПо мнению опрошенных экспертов, совокупность известных данных складывается в пользу сохранения ставки на уровне 14%. При этом отдельные участники опроса допускают снижение на 25 базисных пунктов, однако не считают такой исход базовым сценарием.\nМнение экспертов\n\"В сентябре текущий рост цен с исключением сезонности замедлился до 6,5% против 7,5% в августе, однако базовая инфляция осталась почти без изменений - 6% против 5,9% ранее. В целом устойчивые показатели инфляции в III квартале находились в диапазоне 5-6%, то есть выше цели и выше уровней II квартала\", - отметил портфельный управляющий УК \"Альфа-капитал\" Алексей Корнев.\nТакже, по его словам, со стороны экономики, с точки зрения ЦБ, может не быть явной необходимости в дополнительном смягчении ДКП. \"Индикатор бизнес-климата Банка России в октябре вырос до 1,2 пункта (+3,6 пункта к сентябрю), предприятия улучшили оценки и ожидания спроса и производства, а безработица по итогам августа оставалась вблизи исторического минимума - 2,2%\", - добавил он.\n\"В конце сентября Минфин повысил оценку дефицита федерального бюджета по итогам 2026 года до 7,34 трлн рублей, или 3,2% ВВП, против 3,79 трлн рублей (1,6% ВВП), заложенных в закон о бюджете\", - подчеркнул управляющий директор рейтинговой службы НРА Сергей Клисенко.\nПри этом он отметил, что по итогам января - сентября дефицит бюджета составил 5,19 трлн рублей (2,2% ВВП) после 5,8 трлн рублей (2,5% ВВП) за январь - август. \"В августе и сентябре бюджет был исполнен с профицитом благодаря росту ненефтегазовых доходов (+18,8% год к году за девять месяцев, в том числе НДС +27,4%). Однако это означает, что по обновленному плану Минфина в IV квартале дефицит должен расшириться еще на 2,2 трлн рублей. В конце года ожидается традиционно высокая концентрация расходов и значительный бюджетный импульс для экономики\", - добавил эксперт.\nРоссияДинамика ключевой ставки Центробанка",
    "published_at": "2026-10-22T21:02:09+00:00",
    "collected_at": "2026-10-22T22:07:25.132532+00:00",
    "categories": [
      "Экономика и бизнес",
      "Динамика ключевой ставки Центробанка"
    ],
    "issuer": null,
    "language": "ru"
  },
  {
    "id": "tass:7a53f387bbb800f0a2c9596b",
    "source": "tass",
    "url": "https://tass.ru/ekonomika/28244167",
    "title": "В Чечне на развитие горных районов привлекли более 5 млрд рублей инвестиций",